{
  "client_name": "Clínica Veterinária Zenvet",
  "summary": "Cliente oculto Zenvet (Camila — tutora de gato em SBO simulando quadro clínico de FLUTD/cistite). Nota 5,9/10 (REGULAR). Tempo de 1ª resposta excelente (2 min, cumpre meta DRO 3 V4MOS), CTA inicial específico (18:30 hoje), defesa de preço sem desconto (FELV+especialização). Mas: 0 captura de nome, 0 perguntas clínicas, 0 reconhecimento de gatilho de urgência (sintoma sugestivo de FLUTD em felino), encerramento passivo no 'vou pensar' e ZERO follow-up em 24h. Confirma empiricamente o gargalo principal do diagnóstico S4 (lead some sem retorno). SDR IA endereça os 6 pontos críticos com impacto projetado +R$5,5k/mês.",
  "summary_headline": "5,9/10 REGULAR · resposta excelente, fechamento passivo · 0 captura de nome, 0 follow-up 24h, 0 reconhecimento clínico — confirma gargalo S4.",
  "summary_highlights": [
    {
      "category": "posicao",
      "label": "Nota Geral",
      "value": "5,9/10",
      "subtext": "Classificação: REGULAR (5.0–6.9). Funciona, mas perde vendas por falta de processo. SDR IA terá alto impacto.",
      "tone": "yellow"
    },
    {
      "category": "vantagem",
      "label": "Tempo de 1ª resposta",
      "value": "2 min",
      "subtext": "Excelente — já cumpre meta DRO 3 V4MOS de 90% ≤10min. Ponto forte real do atendimento.",
      "tone": "green"
    },
    {
      "category": "risco",
      "label": "Captura de nome",
      "value": "0",
      "subtext": "Loíse não pediu nem o nome da tutora nem o nome da gata. Sem identificação, follow-up estruturado é impossível.",
      "tone": "red"
    },
    {
      "category": "risco",
      "label": "Follow-up em 24h",
      "value": "Nenhum",
      "subtext": "Confirma o churn_reason 'lead some sem retorno' do briefing + gargalo Contato→Agendamento (24%) do diagnóstico S4.",
      "tone": "red"
    },
    {
      "category": "risco",
      "label": "Reconhecimento clínico",
      "value": "0/10",
      "subtext": "Camila descreveu xixi fora da caixa há 2 sem + anorexia (gatilho FLUTD/cistite). Em clínica especialista em felinos, esperava-se reflexo de urgência. Foi tratado como agendamento de rotina.",
      "tone": "red"
    },
    {
      "category": "oportunidade",
      "label": "Impacto projetado SDR IA",
      "value": "+R$5,5k/mês",
      "subtext": "Endereça os 6 pontos críticos. Combinado com Actions 1+2 do diagnóstico S4 (follow-up Kommo + script consultivo).",
      "tone": "blue"
    }
  ],
  "summary_key_findings": [
    {
      "category": "vantagem",
      "text": "Loíse demonstra fundamentos comerciais sólidos: respondeu em 2 minutos (15:29 → 15:31), apresentou-se pessoalmente ('Meu nome é Louise sou secretária da Zenvet'), ofereceu horário concreto na 2ª mensagem (18:30 hoje), e defendeu valor sem ceder desconto na objeção 'caro vs Animed'. O problema não é capacidade individual — é falta de processo estruturado."
    },
    {
      "category": "ameaca",
      "text": "Camila descreveu quadro clínico clássico de urgência felina (xixi fora da caixa há 2 semanas + parou de comer = sinal sugestivo de FLUTD/cistite, potencial obstrução urinária). Em uma clínica que se posiciona como especialista em felinos, é razoável esperar reflexo: 'eu te encaixo HOJE, esses casos não devem esperar'. Em vez disso, recebeu tratamento de agendamento de rotina (18:30 como sugestão genérica). Falha estrutural de senso clínico-comercial."
    },
    {
      "category": "ameaca",
      "text": "Zero captura de identificação (nome da tutora, nome da gata, idade, há quanto tempo, sexo) torna IMPOSSÍVEL personalizar follow-up estruturado, alimentar CRM ou disparar régua de nutrição. Conecta diretamente ao gargalo principal do diagnóstico S4: dos 50 leads contatados/mês, 38 não agendam — sem identificação, viram fantasmas no funil."
    },
    {
      "category": "ameaca",
      "text": "Encerramento passivo no 'vou pensar' (Loíse: 'Sem problemas, ficamos à disposição ☺️') + ZERO follow-up em 24h confirma empiricamente o churn_reason 'lead some sem retorno' do briefing e o gargalo principal do S4. Em ciclo curto da Zenvet (consulta mesmo dia), 24h sem retomada = lead perdido para concorrente ou desistência. O correto seria: 'Ficou alguma outra dúvida que te ajudaria a trazer ela hoje ainda? Esses casos de bexiga podem ser urgentes, recomendo trazer o quanto antes.'"
    },
    {
      "category": "acao",
      "text": "SDR IA endereça os 6 pontos críticos com impacto cumulativo projetado de +R$5,5k/mês: (1) captura de nome na 2ª mensagem; (2) matriz de red flags clínicos felinos pra reconhecer urgência automaticamente; (3) playbook de objeção de preço em 3 movimentos (contexto + prova social + custo da inação); (4) follow-up automático 24h/72h/7d via Kommo; (5) detecção de 'vou pensar' com fechamento ativo + escassez; (6) 3 perguntas obrigatórias de aprofundamento clínico antes de orçar."
    }
  ],
  "buyer_profile": {
    "name": "Camila Lima",
    "situation": "Tutora de gato, 33 anos, professora, residente em Santa Bárbara d'Oeste. Gata castrada chamada 'Mel' (5 anos, SRD) com xixi fora da caixa há 2 semanas e diminuição de apetite (sinal sugestivo de FLUTD/cistite). Já levou em outro veterinário ('pet em geral') e ficou desconfortável — procurando especialista em felinos. Encontrou Zenvet via Instagram.",
    "urgency": "medium",
    "urgency_reason": "Sintoma persistente há 2 semanas, com piora (anorexia) — quadro sugestivo de problema urinário em felino, urgência clínica relativa (não emergência absoluta, mas requer atendimento na semana).",
    "budget": "Implícito — vai comparar com hospital concorrente (Animed) que oferece consulta R$ 70. Testar reação à objeção de preço (deal-killer mapeado no diagnóstico S4).",
    "main_objection": "Preço acima do hospital 24h vizinho (Animed R$ 70 vs Zenvet R$ 140) + receio de exames desnecessários (trauma com clínicas anteriores que retiveram animal até pagamento)",
    "knowledge_level": "medium"
  },
  "simulation_script": {
    "opening_message": "Oi, boa tarde! 🙂 Vi vocês no Instagram e queria saber se atendem gata. A minha gata tá fazendo xixi fora da caixa há umas duas semanas e parou de comer direito, tô preocupada. Vocês têm horário essa semana? Quanto fica a consulta?",
    "followup_30min": "Oi, ainda tô esperando. Me responde quando puder? 🙏",
    "followup_2h": "Oi pessoal, ninguém respondeu ainda. Vou ver outras opções — me chama se ainda puder atender essa semana.",
    "questions": [
      {
        "question": "Vocês têm vet especialista em gato mesmo? Eu já levei a Mel num lugar que falaram que era 'pet em geral' e não me senti segura.",
        "objective": "Testa identificação automática do diferencial Zenvet (especialização Nathalia em felinos) — a Loíse precisa saber posicionar isso espontaneamente."
      },
      {
        "question": "Olha, eu vi no [hospital 24h da avenida / Animed] que a consulta tá R$70. Aqui fica mais? Por quê?",
        "objective": "Deal-killer principal mapeado no diagnóstico S4 (objeção de preço vs concorrente). Testa se Loíse defende valor sem ceder desconto, posiciona transparência item-a-item, usa prova social."
      },
      {
        "question": "Vocês acham que vai precisar de exame logo de cara? Tenho receio de gastar muito de uma vez sem saber se precisa mesmo...",
        "objective": "Trust + objeção 'exames desnecessários' (trauma da Mariana no ICP S1). Testa se Loíse comunica transparência item-a-item antes de qualquer procedimento."
      },
      {
        "question": "Hmm, deixa eu pensar e te respondo. (parar de responder por 7 dias)",
        "objective": "Follow-up test — testa se há régua estruturada (24h/72h/7d) para resgate de leads que hesitam. Critério central do DRO 3 V4MOS."
      }
    ],
    "buyer_behavior_rules": [
      "Atraso realista entre mensagens: 5-15min em horário comercial (multitasking de tutora real)",
      "Não revelar que é teste em nenhum momento",
      "Inventar dados consistentes quando perguntar (Camila Lima, SBO, gata Mel 5 anos castrada SRD)",
      "Não oferecer informação sem ser perguntada — só responder o que é perguntado",
      "Após pergunta #4 ('vou pensar'): PARAR de responder por 7 dias completos, anotar follow-ups em 24h/72h/7d",
      "Documentar TODA a conversa com horários (print do WhatsApp ou anotação)"
    ]
  },
  "simulation_metadata": {
    "date": "2026-05-07",
    "channel": "WhatsApp",
    "attendant_name": "Louise (Loíse no briefing)",
    "total_duration_minutes": 30,